{
  "$schema": "http://json-schema.org/draft-07/schema#",
  "title": "ERD Studio domain",
  "description": "A subject area diagram: .erd-studio/{layer}/{name}.json. References tables by name and holds relationships and canvas layout. Written in the project's naming: schema v6 (\"subjectArea\", \"logical.tables\", \"fromTable\" / \"toTable\") or v5 (\"domain\", \"logical.models\", \"fromModel\" / \"toModel\"); `erd-studio doctor` reports which. Reference: https://github.com/liam-machine/erd-studio/blob/main/docs/semantic-domain-json-reference.md#domain-file-erd-studiolayerdomainjson",
  "type": "object",
  "required": [
    "schemaVersion",
    "layer",
    "logical"
  ],
  "additionalProperties": false,
  "properties": {
    "$schema": {
      "type": "string",
      "description": "Optional schema reference for editors outside VS Code. Ignored by ERD Studio."
    },
    "schemaVersion": {
      "type": "integer",
      "enum": [
        6,
        5,
        4
      ],
      "description": "File format version. 6 for the table naming (\"subjectArea\", \"logical.tables\"), 5 for the model naming (\"domain\", \"logical.models\"): write the one `erd-studio doctor` reports. Version 4 (inline model objects) still loads until migrated with \"ERD Studio: Migrate Subject Areas to the Central Table Library\"."
    },
    "domain": {
      "type": "string",
      "minLength": 1,
      "description": "Schema v5 and v4: the subject area slug. Should equal the file name without .json. Schema v6 calls it \"subjectArea\"."
    },
    "subjectArea": {
      "type": "string",
      "minLength": 1,
      "description": "Schema v6: the subject area slug. Should equal the file name without .json."
    },
    "layer": {
      "type": "string",
      "minLength": 1,
      "description": "Must match an id in layers.json and the parent directory name."
    },
    "description": {
      "type": "string",
      "description": "Human-readable domain description."
    },
    "modelFolder": {
      "type": "string",
      "description": "Path prefix filter for the \"Add Existing Model\" dialog, e.g. models/silver."
    },
    "stubColumns": {
      "type": "array",
      "description": "Models (typically conformed dimensions / reference tables) that define only key columns. Missing-column discrepancies for them are hidden in Compare.",
      "items": {
        "type": "string"
      },
      "uniqueItems": true
    },
    "logical": {
      "type": "object",
      "description": "The editable logical stage.",
      "required": [
        "relationships"
      ],
      "additionalProperties": false,
      "properties": {
        "models": {
          "type": "array",
          "description": "Schema v5 and v4: table NAME strings. Each resolves to .erd-studio/logical-models/{name}.yml or .erd-studio/logical-models/{folder}/{name}.yml. Never mix names with inline model objects — such a file does not open. Schema v6 calls it \"tables\".",
          "oneOf": [
            {
              "items": {
                "type": "string",
                "minLength": 1
              }
            },
            {
              "items": {
                "type": "object",
                "required": [
                  "name"
                ],
                "description": "Deprecated version 4 inline model. Run \"ERD Studio: Migrate Domains to Central Model Store\"."
              },
              "minItems": 1
            }
          ]
        },
        "tables": {
          "type": "array",
          "description": "Schema v6: table NAME strings. Each resolves to .erd-studio/tables/{name}.yml or .erd-studio/tables/{folder}/{name}.yml.",
          "items": {
            "type": "string",
            "minLength": 1
          }
        },
        "relationships": {
          "type": "array",
          "description": "FK relationships. (from, fromColumn, to, toColumn) must be unique within the subject area.",
          "items": {
            "$ref": "#/definitions/relationship"
          }
        },
        "viewConfig": {
          "description": "Deprecated location — viewConfig belongs at the root of the document.",
          "allOf": [
            {
              "$ref": "#/definitions/viewConfig"
            }
          ]
        }
      }
    },
    "viewConfig": {
      "description": "Canvas layout, at the root of the document. Write {} for a new domain — models without a position are placed automatically.",
      "allOf": [
        {
          "$ref": "#/definitions/viewConfig"
        }
      ]
    }
  },
  "if": {
    "properties": {
      "schemaVersion": {
        "const": 5
      }
    },
    "required": [
      "schemaVersion"
    ]
  },
  "then": {
    "properties": {
      "logical": {
        "properties": {
          "models": {
            "items": {
              "type": "string"
            }
          }
        }
      }
    }
  },
  "definitions": {
    "relationship": {
      "type": "object",
      "required": [
        "fromColumn",
        "toColumn",
        "cardinality"
      ],
      "additionalProperties": false,
      "properties": {
        "fromModel": {
          "type": "string",
          "minLength": 1,
          "description": "Schema v5: the table holding the FK (the \"many\" side of many-to-one). Schema v6 calls it \"fromTable\"."
        },
        "fromTable": {
          "type": "string",
          "minLength": 1,
          "description": "Schema v6: the table holding the FK (the \"many\" side of many-to-one)."
        },
        "fromColumn": {
          "type": "string",
          "minLength": 1,
          "description": "FK column on fromModel."
        },
        "toModel": {
          "type": "string",
          "minLength": 1,
          "description": "Referenced model (PK side). Schema v6 calls it \"toTable\"."
        },
        "toTable": {
          "type": "string",
          "minLength": 1,
          "description": "Schema v6: the referenced table (the \"one\" side)."
        },
        "toColumn": {
          "type": "string",
          "minLength": 1,
          "description": "Referenced PK column on toModel."
        },
        "cardinality": {
          "type": "string",
          "description": "Relationship cardinality, read from fromModel to toModel.",
          "enum": [
            "many-to-one",
            "one-to-one",
            "one-to-many",
            "many-to-many"
          ]
        },
        "role": {
          "type": "string",
          "minLength": 1,
          "maxLength": 60,
          "description": "Optional label for what this link means, e.g. \"order date\" and \"ship date\" for two columns pointing at the same date dimension. A label only; it is not part of the relationship's identity."
        },
        "compositeKey": {
          "type": "string",
          "minLength": 1,
          "maxLength": 64,
          "description": "Entries of this file with the same fromModel that share this value form one composite foreign key: one relationship over several column pairs, drawn as one line. Each entry is one column pair; all must point at the same toModel with the same cardinality (many-to-one or one-to-one). ERD Studio 1.6.7 and earlier read the entries as separate relationships and drop this key when they save the file."
        }
      },
      "oneOf": [
        {
          "required": [
            "fromModel",
            "toModel"
          ]
        },
        {
          "required": [
            "fromTable",
            "toTable"
          ]
        }
      ]
    },
    "viewConfig": {
      "type": "object",
      "description": "Canvas layout. Safe to leave as {} — models without a position are placed automatically.",
      "additionalProperties": false,
      "properties": {
        "showFkEdges": {
          "type": "boolean",
          "description": "Whether FK edges are drawn."
        },
        "layoutOptions": {
          "type": "object",
          "description": "ELK layout options as string key/value pairs, e.g. \"elk.direction\": \"DOWN\".",
          "additionalProperties": {
            "type": "string"
          }
        },
        "positions": {
          "type": "object",
          "description": "Node positions keyed by model name. Preserve existing entries when adding models.",
          "additionalProperties": {
            "$ref": "#/definitions/position"
          }
        },
        "annotations": {
          "type": "array",
          "description": "Canvas post-it notes.",
          "items": {
            "$ref": "#/definitions/annotation"
          }
        }
      }
    },
    "position": {
      "type": "object",
      "required": [
        "x",
        "y"
      ],
      "additionalProperties": false,
      "properties": {
        "x": {
          "type": "number"
        },
        "y": {
          "type": "number"
        }
      }
    },
    "annotation": {
      "type": "object",
      "required": [
        "id",
        "text",
        "x",
        "y"
      ],
      "additionalProperties": false,
      "properties": {
        "id": {
          "type": "string",
          "minLength": 1,
          "description": "Unique note id."
        },
        "text": {
          "type": "string",
          "description": "Note text."
        },
        "x": {
          "type": "number"
        },
        "y": {
          "type": "number"
        },
        "width": {
          "type": "number"
        },
        "height": {
          "type": "number"
        },
        "color": {
          "type": "string",
          "description": "Note colour.",
          "enum": [
            "yellow",
            "blue",
            "green",
            "pink",
            "orange"
          ]
        },
        "linkedModel": {
          "type": "string",
          "description": "Schema v5: draws a dashed edge from the note to this table. Schema v6 calls it \"linkedTable\"."
        },
        "linkedTable": {
          "type": "string",
          "description": "Schema v6: draws a dashed edge from the note to this table."
        }
      }
    }
  },
  "allOf": [
    {
      "if": {
        "properties": {
          "schemaVersion": {
            "const": 6
          }
        },
        "required": [
          "schemaVersion"
        ]
      },
      "then": {
        "required": [
          "subjectArea"
        ],
        "not": {
          "anyOf": [
            {
              "required": [
                "domain"
              ]
            }
          ]
        },
        "properties": {
          "logical": {
            "required": [
              "tables"
            ],
            "not": {
              "required": [
                "models"
              ]
            }
          }
        }
      },
      "else": {
        "required": [
          "domain"
        ],
        "not": {
          "anyOf": [
            {
              "required": [
                "subjectArea"
              ]
            }
          ]
        },
        "properties": {
          "logical": {
            "required": [
              "models"
            ],
            "not": {
              "required": [
                "tables"
              ]
            }
          }
        }
      }
    }
  ]
}
