{
  "schemaVersion": 5,
  "domain": "orders",
  "layer": "silver",
  "description": "A model file with a key written twice, read as PyYAML reads it (#164)",
  "logical": {
    "models": [
      {
        "name": "fct_order",
        "description": "One row per order",
        "columns": [
          {
            "name": "order_id",
            "dataType": "integer",
            "description": "",
            "isPrimaryKey": true
          },
          {
            "name": "customer_id",
            "dataType": "integer",
            "description": ""
          }
        ]
      },
      {
        "name": "dim_customer",
        "description": "One row per customer",
        "columns": [
          {
            "name": "customer_id",
            "dataType": "integer",
            "description": "",
            "isPrimaryKey": true
          },
          {
            "name": "email",
            "dataType": "varchar",
            "description": "Primary contact email"
          }
        ],
        "loadWarning": {
          "kind": "yamlDuplicateKey",
          "key": "description",
          "line": 4
        }
      }
    ],
    "relationships": [
      {
        "fromModel": "fct_order",
        "fromColumn": "customer_id",
        "toModel": "dim_customer",
        "toColumn": "customer_id",
        "cardinality": "many-to-one"
      }
    ]
  },
  "viewConfig": {
    "positions": {
      "fct_order": {
        "x": 0,
        "y": 0
      },
      "dim_customer": {
        "x": 400,
        "y": 0
      }
    }
  }
}
